{
  "schemaVersion": "0.2.0", "linkId": "evidence-fixture-ios", "modelId": "openai-community/gpt2", "modelRevision": "0123456789abcdef0123456789abcdef01234567", "platform": "ios", "artifactPath": "evidence/runs/fixture.json", "artifactChecksum": "sha256:0123456789abcdef0123456789abcdef0123456789abcdef0123456789abcdef", "createdAt": "2026-09-17T00:00:00.000Z", "kind": "benchmark-result", "reviewer": null
}
